Sheet: Sheet1
A2: Id | B2: Autor | C2: Titlu | D2: Colecția | E2: Unde | F2: Lang
A4: 1 | B4: Grigore Ureche | C4: Letopisețul țării Moldovei | D4: Ev | E4: Ureche-Letopisetul_tarii_Moldovei,_de_cand_s-au_descalecat_tara.fodt
A5: of:=[.A4]+1 -> 2 | B5: Alecu Russo | C5: Cântarea României și altele | D5: Pașopt | E5: Russo,Alecu-Cantarea_Romaniei.fodt
A6: of:=[.A5]+1 -> 3 | B6: Garabet Ibrăileanu | C6: Adela | D6: Interbellum | E6: Ibraileanu,Garabet-Adela.fodt
A7: of:=[.A6]+1 -> 4 | B7: Liviu Rebreanu | C7: Ion | D7: Interbellum | E7: Rebreanu-Ion.fodt
A8: of:=[.A7]+1 -> 5 | B8: Nicolae Bălcescu | C8: Românii supt Mihai-Voievod Viteazul | D8: Pașopt | E8: Balcescu-Romanii_supt_Mihai-Voievod_Viteazul.fodt
A9: of:=[.A8]+1 -> 6 | B9: Liviu Rebreanu | C9: Crăișorul Horia | D9: Interbellum | E9: Rebreanu-Craisorul_Horia.fodt
A11: of:=[.A44]+1 -> 8 | B11: Miron Costin | C11: Letopisețul țării Moldovei. De neamul moldovenilor | D11: Ev | E11: Costin-Letopisetul_tarii_moldovei_de_la_aaron_voda_incoace.fodt
A12: of:=[.A11]+1 -> 9 | B12: Neagoe Basarab | C12: Învățăturile lui Neagoe Basarab către fiul său Teodosie | D12: Ev | E12: Basarab,N-Invataturile_lui_Neagoe_Basarab_catre_fiul_sau_Teodosie.fodt
A13: of:=[.A12]+1 -> 10 | B13: Mateiu Caragiale | C13: Craii de Curtea Veche | D13: Interbellum | E13: Caragiale,M-Craii_de_Curtea_Veche.fodt
A14: of:=[.A13]+1 -> 11 | B14: Nicolae Iorga | C14: Istoria românilor prin călători | D14: Classique | E14: Iorga-Istoria_romanilor_prin_calatori.fodt
A15: of:=[.A14]+1 -> 12 | B15: Gib Mihăescu | C15: Donna Alba | D15: Interbellum | E15: Mihaescu,G-Donna_Alba.fodt
A16: of:=[.A15]+1 -> 13 | B16: Alexandru Odobescu | C16: Doamna Chiajna. Mihnea Vodă cel rău. Pseudo-Kynegetikos | D16: Pașopt | E16: Odobescu-Doamna_Chiajna,Mihnea.fodt
A17: of:=[.A16]+1 -> 14 | B17: Ion Minulescu | C17: Roșu, galben și albastru. Corigent la limba română | D17: Interbellum | E17: Minulescu-Rosu,_galben_si_albastru.fodt
A18: of:=[.A17]+1 -> 15 | B18: Liviu Rebreanu | C18: Pădurea spânzuraților | D18: Interbellum | E18: Rebreanu-Padurea_spanzuratilor.fodt
A19: of:=[.A18]+1 -> 16 | B19: Mihai Zamfirescu | C19: Maidanul cu dragoste | D19: Interbellum | E19: Zamfirescu-Maidanul_cu_dragoste.fodt
A20: 17 | B20: Eugen Lovinescu | C20: Mite. Bălăuca | D20: Interbellum | E20: Lovinescu-Mite,Balauca.fodt
A21: 18 | B21: Panait Istrati | C21: Ciulinii Bărăganului | D21: Interbellum | E21: Istrati-Ciulinii_Baraganului.fodt
A22: 19 | B22: Liviu Rebreanu | C22: Ciuleandra | D22: Interbellum | E22: Rebreanu-Ciuleandra.fodt
A23: 20 | B23: Liviu Rebreanu | C23: Răscoala | D23: Interbellum | E23: Rebreanu-Rascoala.fodt
A26: 23 | B26: Calistrat Hogaș | C26: Pe drumuri de munte | D26: Classique | E26: Hogas-Pe_drumuri_de_munte.fodt
A27: 24 | B27: Ioan Slavici | C27: Nuvele | D27: Classique | E27: Slavici-Nuvele.fodt
A28: 25 | B28: Ioan Slavici | C28: Mara, Povești și altele | D28: Classique | E28: Slavici-Mara,Povesti.fodt
A29: 26 | B29: Ioan Slavici | C29: Amintiri | D29: Classique | E29: Slavici-Amintiri.fodt
A30: 27 | B30: Dimitrie Cantemir | C30: Istoria ieroglifică | D30: Ev | E30: Cantemir-Istoria_ieroglifica.fodt
A31: 28 | B31: Emil Gârleanu | C31: Din lumea celor care nu cuvântă și alte scrieri | D31: Interbellum | E31: Garleanu-Scrieri.fodt
A32: 29 | B32: Ion Neculce | C32: O samă de cuvinte. Letopisețul țării Moldovei | D32: Ev | E32: Neculce-O_sama_de_cuvinte_Letopiset.fodt
A33: 30 | B33: Costache Negruzzi | C33: Scrieri | D33: Pașopt | E33: Negruzzi,C-Scrieri.fodt
A34: 31 | B34: George Topârceanu | C34: Proze | D34: Interbellum | E34: Toparceanu-Scrieri.fodt
A35: 32 | B35: Vasile Alecsandri | C35: Articole, călătorii, proză, teatru | D35: Pașopt | E35: Alecsandri-Scrieri.fodt
A36: 33 | B36: Mihai Eminescu | C36: Basme. Proză | D36: Classique | E36: Eminescu-Proza.fodt
A37: 34 | B37: Mihai Eminescu | C37: Publicistică I | D37: Classique | E37: Eminescu-Publicistica.fodt
A38: 35 | B38: Mihai Eminescu | C38: Publicistică II | D38: Classique | E38: Eminescu-Publicistica_2.fodt
A39: 36 | B39: Mihail Kogălniceanu | C39: Scrieri literare și politice | D39: Pașopt | E39: Kogalniceanu-Scrieri_literare_si_politice.fodt
A40: 37 | B40: Duiliu Zamfirescu | C40: Tănase Scatiu. Viața la țară | D40: Classique | E40: Zamfirescu,Duiliu-Tanase_Scatiu,Viata_la_tara.fodt
A41: 38 | B41: Pompiliu Eliade | C41: Histoire de l’esprit public en Roumanie au dix-neuvième siècle | D41: Classique | E41: Eliade,Pompiliu-Histoire_esprit_public_19eme.fodt
A44: of:=[.A9]+1 -> 7 | B44: Ion Creangă | C44: Amintiri, povești și altele | D44: Classique | E44: Creanga-Amintiri_din_copilarie.fodt
A45: 21 | B45: Dimitrie Cantemir | C45: Descrierea Moldovei | D45: Ev | E45: Cantemir-Descrierea_Moldovei.fodt
A46: 22 | B46: Dimitrie Cantemir | C46: Hronicul vechimii româno-moldo-vlahilor | D46: Ev | E46: Cantemir-Hronicul_vechimei_a_romano-moldo-vlahilor.fodt
A49: 100 | B49: Jean-Jacques Rousseau | C49: Du contrat social ou principes du droit politique | D49: Biblioteca franceză | E49: Rousseau-Contrat_social.fodt
A52: 200 | B52: Petru Dimulescu | C52: #Pythô | D52: Egraphsen | E52: Dimulescu-Pytho.fodt
A55: 201 | B55: Cantemir,Dimitrie | C55: Sistemul și întocmirea religiei mahomedane | D55: ? | E55: Cantemir-Sistemul_si_intocmirea_religiei_muhamedane.fodt
A56: 202 | C56: Cantemir-Viata_lui_Constantin_Cantemir.fodt | E56: Cantemir-Viata_lui_Constantin_Cantemir.fodt
A57: 203 | C57: Eliade,Pompiliu-Influence_de l_esprit_francais.fodt | E57: Eliade,Pompiliu-Influence_de_l_esprit_francais.fodt
A58: 204 | C58: Filimon-Ciocoii.fodt | E58: Filimon-Ciocoii.fodt
A59: 205 | C59: Filimon-Nuvele.fodt | E59: Filimon-Nuvele.fodt
A60: 206 | C60: Ispirescu-Basme.fodt | E60: Ispirescu-Basme.fodt
A61: 207 | C61: Istrati-ChiraChiralina,MosAnghel.fodt | E61: Istrati-ChiraChiralina,MosAnghel.fodt
A62: 208 | C62: Maiorescu-Critice.fodt | E62: Maiorescu-Critice.fodt
A63: 209 | C63: Zamfirescu,Duiliu-In_razboi.fodt | E63: Zamfirescu,Duiliu-In_razboi.fodt
A64: 210 | C64: Zamfirescu,Duiliu-Publicistica.fodt | E64: Zamfirescu,Duiliu-Publicistica.fodt